{
  "kind": "engine-scenario",
  "engine": "fop1",
  "id": "cop1-fop1-s3-e27",
  "description": "FOP-1 Table 5-1, S3 x E27: Directive Initiate AD Service (with Set V(R)), BC_Out_Flag Ready. setup of 3 step(s), then the trigger.",
  "requirements": [
    "COP-001",
    "COP-005"
  ],
  "provenance": "hand-derived",
  "provenance_note": "Hand-derived from 232.1-B-2 Cor. 1 Table 5-1, 5.1 and 5.2 and 232.0-B-4 4.1.2, 4.1.3.3, 4.1.4.2. Model test-vectors/models/cop1.py, written blind (TV-023) by a Claude agent from the Blue Books and docs/ only, without reading any implementation; docs/verification/reviews/cop1-tables.md was read as input and the transcription compared with it. The setup is the shortest input sequence found by breadth-first search over the model's input alphabet; the expected outputs are the model's.",
  "config": {
    "frame_target": "tc",
    "scid": 42,
    "vcid": 1,
    "t1_initial_us": 2000000,
    "transmission_limit": 3,
    "timeout_type": 0,
    "k": 3,
    "fecf": true
  },
  "steps": [
    {
      "at_us": 1000,
      "input": {
        "directive": {
          "handle": 1,
          "type": "initiate_ad_without_clcw_check"
        }
      },
      "expect": [
        {
          "event": "directive_notify",
          "handle": 1,
          "type": "accept"
        },
        {
          "event": "directive_notify",
          "handle": 1,
          "type": "positive_confirm"
        }
      ],
      "expect_state": "S1"
    },
    {
      "at_us": 2000,
      "input": {
        "request_ad": {
          "handle": 2,
          "data_hex": "A002"
        }
      },
      "expect": [
        {
          "event": "transfer_notify",
          "handle": 2,
          "type": "accept"
        },
        {
          "transmit": {
            "kind": "AD",
            "ns": 0,
            "retransmission": false,
            "frame_hex": "002A040800A002733D"
          }
        }
      ],
      "expect_state": "S1",
      "expect_timeout_us": 2002000
    },
    {
      "at_us": 3000,
      "input": {
        "clcw": {
          "lockout": false,
          "wait": true,
          "retransmit": true,
          "n_r": 0
        }
      },
      "expect": [],
      "expect_state": "S3",
      "expect_timeout_us": 2002000
    },
    {
      "at_us": 4000,
      "input": {
        "directive": {
          "handle": 4,
          "type": "initiate_ad_with_set_vr",
          "value": 9
        }
      },
      "expect": [
        {
          "event": "directive_notify",
          "handle": 4,
          "type": "reject"
        }
      ],
      "expect_state": "S3",
      "expect_timeout_us": 2002000
    },
    {
      "at_us": 4000,
      "input": {
        "query": "next_deadline"
      },
      "expect": [
        {
          "next_deadline": 2002000
        }
      ],
      "expect_state": "S3",
      "expect_timeout_us": 2002000
    }
  ]
}
