{
  "kind": "engine-scenario",
  "engine": "farm1",
  "id": "cop1-farm1-physical-flags",
  "description": "No RF Available and No Bit Lock are set from outside and appear in the CLCW; they are not part of the state table.",
  "requirements": [
    "COP-002",
    "COP-035"
  ],
  "provenance": "hand-derived",
  "provenance_note": "Hand-derived from 232.1-B-2 Cor. 1 Table 6-1, 6.1 and 6.2 and 232.0-B-4 4.1.2, 4.1.3.3, 4.2.1. Model test-vectors/models/cop1.py, written blind (TV-023) by a Claude agent from the Blue Books and docs/ only, without reading any implementation; docs/verification/reviews/cop1-tables.md was read as input and the transcription compared with it. The input script was chosen by hand; the expected outputs are the model's.",
  "config": {
    "frame_target": "tc",
    "scid": 42,
    "vcid": 1,
    "fecf": true,
    "status_field": 0,
    "window": {
      "retransmission_allowed": true,
      "w": 8
    },
    "v_r": 0
  },
  "steps": [
    {
      "at_us": 0,
      "input": {
        "query": "clcw"
      },
      "expect": [
        {
          "clcw": {
            "lockout": false,
            "wait": false,
            "retransmit": false,
            "farm_b_counter": 0,
            "n_r": 0,
            "cop_in_effect": 1,
            "vcid": 1,
            "status_field": 0,
            "no_rf_available": false,
            "no_bit_lock": false
          },
          "clcw_hex": "01040000"
        }
      ],
      "expect_state": "S1"
    },
    {
      "at_us": 1000,
      "input": {
        "set_physical_flags": {
          "no_rf_available": true,
          "no_bit_lock": false
        }
      },
      "expect": [],
      "expect_state": "S1"
    },
    {
      "at_us": 2000,
      "input": {
        "query": "clcw"
      },
      "expect": [
        {
          "clcw": {
            "lockout": false,
            "wait": false,
            "retransmit": false,
            "farm_b_counter": 0,
            "n_r": 0,
            "cop_in_effect": 1,
            "vcid": 1,
            "status_field": 0,
            "no_rf_available": true,
            "no_bit_lock": false
          },
          "clcw_hex": "01048000"
        }
      ],
      "expect_state": "S1"
    },
    {
      "at_us": 3000,
      "input": {
        "set_physical_flags": {
          "no_rf_available": false,
          "no_bit_lock": true
        }
      },
      "expect": [],
      "expect_state": "S1"
    },
    {
      "at_us": 4000,
      "input": {
        "query": "clcw"
      },
      "expect": [
        {
          "clcw": {
            "lockout": false,
            "wait": false,
            "retransmit": false,
            "farm_b_counter": 0,
            "n_r": 0,
            "cop_in_effect": 1,
            "vcid": 1,
            "status_field": 0,
            "no_rf_available": false,
            "no_bit_lock": true
          },
          "clcw_hex": "01044000"
        }
      ],
      "expect_state": "S1"
    }
  ]
}
