{
  "kind": "engine-scenario",
  "engine": "farm1",
  "id": "cop1-farm1-s1-e10",
  "description": "FARM-1 Table 6-1, S1 x E10: Buffer release signal. setup of 0 step(s), then the trigger.",
  "requirements": [
    "COP-002",
    "COP-005",
    "COP-033"
  ],
  "provenance": "hand-derived",
  "provenance_note": "Hand-derived from 232.1-B-2 Cor. 1 Table 6-1, 6.1 and 6.2 and 232.0-B-4 4.1.2, 4.1.3.3, 4.2.1. Model test-vectors/models/cop1.py, written blind (TV-023) by a Claude agent from the Blue Books and docs/ only, without reading any implementation; docs/verification/reviews/cop1-tables.md was read as input and the transcription compared with it. The setup is the shortest input sequence found by breadth-first search over the model's input alphabet; the expected outputs are the model's.",
  "config": {
    "frame_target": "tc",
    "scid": 42,
    "vcid": 1,
    "fecf": true,
    "status_field": 0,
    "window": {
      "retransmission_allowed": true,
      "w": 8
    },
    "v_r": 0
  },
  "steps": [
    {
      "at_us": 1000,
      "input": {
        "buffer_released": {}
      },
      "expect": [],
      "expect_state": "S1"
    }
  ]
}
