{
  "kind": "engine-scenario",
  "engine": "farm1",
  "id": "cop1-farm1-s3-e6",
  "description": "FARM-1 Table 6-1, S3 x E6: Valid Type-BD frame. setup of 1 step(s), then the trigger.",
  "requirements": [
    "COP-002",
    "COP-005",
    "COP-030",
    "COP-034",
    "COP-006"
  ],
  "provenance": "hand-derived",
  "provenance_note": "Hand-derived from 232.1-B-2 Cor. 1 Table 6-1, 6.1 and 6.2, 232.0-B-4 4.1.2, 4.1.3.3, 4.2.1 and docs/standards/cop1.md; expected values come from the independent model test-vectors/models/cop1.py, written blind by an agent that had not read the implementation (TV-023).",
  "config": {
    "frame_target": "tc",
    "scid": 42,
    "vcid": 1,
    "fecf": true,
    "status_field": 0,
    "window": {
      "retransmission_allowed": true,
      "w": 8
    },
    "v_r": 0
  },
  "steps": [
    {
      "at_us": 1000,
      "input": {
        "frame": {
          "frame_hex": "002A040804C0DEAE26",
          "buffer_available": true
        }
      },
      "expect": [
        {
          "event": "frame_discarded",
          "event_number": 5,
          "state": "S1"
        },
        {
          "event": "state_changed",
          "event_number": 5,
          "from": "S1",
          "to": "S3"
        }
      ],
      "expect_state": "S3"
    },
    {
      "at_us": 2000,
      "input": {
        "frame": {
          "frame_hex": "202A040800BD015887",
          "buffer_available": true
        }
      },
      "expect": [
        {
          "deliver": {
            "kind": "BD",
            "ns": 0,
            "data_hex": "BD01"
          }
        }
      ],
      "expect_state": "S3"
    }
  ]
}
