{
  "kind": "engine-scenario",
  "engine": "fop1",
  "id": "cop1-fop1-s6-e14",
  "description": "FOP-1 Table 5-1, S6 x E14: CLCW with the Lockout Flag set. setup of 0 step(s), then the trigger.",
  "requirements": [
    "COP-001",
    "COP-005",
    "COP-012"
  ],
  "provenance": "hand-derived",
  "provenance_note": "Hand-derived from 232.1-B-2 Cor. 1 Table 5-1, 5.1 and 5.2 and 232.0-B-4 4.1.2, 4.1.3.3, 4.1.4.2. Model test-vectors/models/cop1.py, written blind (TV-023) by a Claude agent from the Blue Books and docs/ only, without reading any implementation; docs/verification/reviews/cop1-tables.md was read as input and the transcription compared with it. The setup is the shortest input sequence found by breadth-first search over the model's input alphabet; the expected outputs are the model's.",
  "config": {
    "frame_target": "tc",
    "scid": 42,
    "vcid": 1,
    "t1_initial_us": 2000000,
    "transmission_limit": 3,
    "timeout_type": 0,
    "k": 3,
    "fecf": true
  },
  "steps": [
    {
      "at_us": 1000,
      "input": {
        "clcw": {
          "lockout": true,
          "wait": false,
          "retransmit": false,
          "n_r": 0
        }
      },
      "expect": [],
      "expect_state": "S6"
    },
    {
      "at_us": 1000,
      "input": {
        "query": "next_deadline"
      },
      "expect": [
        {
          "next_deadline": null
        }
      ],
      "expect_state": "S6"
    }
  ]
}
