{
  "kind": "engine-scenario",
  "engine": "fop1",
  "id": "cop1-fop1-s5-e36",
  "description": "FOP-1 Table 5-1, S5 x E36: Directive Set FOP_Sliding_Window_Width (K). setup of 1 step(s), then the trigger.",
  "requirements": [
    "COP-001",
    "COP-005",
    "COP-010",
    "COP-013",
    "COP-015",
    "COP-006"
  ],
  "provenance": "hand-derived",
  "provenance_note": "Hand-derived from 232.1-B-2 Cor. 1 Table 5-1, 5.1 and 5.2, 232.0-B-4 4.1.2, 4.1.3.3, 4.1.4.2 and docs/standards/cop1.md; expected values come from the independent model test-vectors/models/cop1.py, written blind by an agent that had not read the implementation (TV-023).",
  "config": {
    "frame_target": "tc",
    "scid": 42,
    "vcid": 1,
    "t1_initial_us": 2000000,
    "transmission_limit": 3,
    "timeout_type": 0,
    "k": 3,
    "fecf": true
  },
  "steps": [
    {
      "at_us": 1000,
      "input": {
        "directive": {
          "handle": 1,
          "type": "initiate_ad_with_unlock"
        }
      },
      "expect": [
        {
          "event": "directive_notify",
          "handle": 1,
          "type": "accept"
        },
        {
          "transmit": {
            "kind": "BC",
            "ns": 0,
            "retransmission": false,
            "frame_hex": "302A0407000020E7"
          }
        }
      ],
      "expect_state": "S5",
      "expect_timeout_us": 2001000
    },
    {
      "at_us": 2000,
      "input": {
        "directive": {
          "handle": 2,
          "type": "set_k",
          "value": 2
        }
      },
      "expect": [
        {
          "event": "directive_notify",
          "handle": 2,
          "type": "accept"
        },
        {
          "event": "directive_notify",
          "handle": 2,
          "type": "positive_confirm"
        }
      ],
      "expect_state": "S5",
      "expect_timeout_us": 2001000
    },
    {
      "at_us": 2000,
      "input": {
        "query": "next_deadline"
      },
      "expect": [
        {
          "next_deadline": 2001000
        }
      ],
      "expect_state": "S5",
      "expect_timeout_us": 2001000
    }
  ]
}
