{
  "kind": "engine-scenario",
  "engine": "fop1",
  "id": "cop1-fop1-s4-e20",
  "description": "FOP-1 Table 5-1, S4 x E20: Request to transfer an AD FDU, Wait_Queue occupied. no input reaches this cell, so the event is injected after a setup of 1 step(s).",
  "requirements": [
    "COP-001",
    "COP-005"
  ],
  "provenance": "hand-derived",
  "provenance_note": "Hand-derived from 232.1-B-2 Cor. 1 Table 5-1, 5.1 and 5.2 and 232.0-B-4 4.1.2, 4.1.3.3, 4.1.4.2. Model test-vectors/models/cop1.py, written blind (TV-023) by a Claude agent from the Blue Books and docs/ only, without reading any implementation; docs/verification/reviews/cop1-tables.md was read as input and the transcription compared with it. The setup is the shortest input sequence found by breadth-first search over the model's input alphabet; the expected outputs are the model's.",
  "config": {
    "frame_target": "tc",
    "scid": 42,
    "vcid": 1,
    "t1_initial_us": 2000000,
    "transmission_limit": 3,
    "timeout_type": 0,
    "k": 3,
    "fecf": true
  },
  "steps": [
    {
      "at_us": 1000,
      "input": {
        "directive": {
          "handle": 1,
          "type": "initiate_ad_with_clcw_check"
        }
      },
      "expect": [
        {
          "event": "directive_notify",
          "handle": 1,
          "type": "accept"
        }
      ],
      "expect_state": "S4",
      "expect_timeout_us": 2001000
    },
    {
      "at_us": 2000,
      "input": {
        "table_event": {
          "event": 20,
          "input": {
            "request_ad": {
              "handle": 2,
              "data_hex": "A002"
            }
          }
        }
      },
      "expect": [
        {
          "event": "transfer_notify",
          "handle": 2,
          "type": "reject"
        }
      ],
      "expect_state": "S4",
      "expect_timeout_us": 2001000
    },
    {
      "at_us": 2000,
      "input": {
        "query": "next_deadline"
      },
      "expect": [
        {
          "next_deadline": 2001000
        }
      ],
      "expect_state": "S4",
      "expect_timeout_us": 2001000
    }
  ]
}
