{
  "kind": "engine-scenario",
  "engine": "fop1",
  "id": "cop1-fop1-s6-e13",
  "description": "FOP-1 Table 5-1, S6 x E13: CLCW with N(R) outside NN(R)..V(S) (modulo 256), lockout clear. setup of 0 step(s), then the trigger.",
  "requirements": [
    "COP-001",
    "COP-005",
    "COP-012",
    "COP-013"
  ],
  "provenance": "hand-derived",
  "provenance_note": "Hand-derived from 232.1-B-2 Cor. 1 Table 5-1, 5.1 and 5.2, 232.0-B-4 4.1.2, 4.1.3.3, 4.1.4.2 and docs/standards/cop1.md; expected values come from the independent model test-vectors/models/cop1.py, written blind by an agent that had not read the implementation (TV-023).",
  "config": {
    "frame_target": "tc",
    "scid": 42,
    "vcid": 1,
    "t1_initial_us": 2000000,
    "transmission_limit": 3,
    "timeout_type": 0,
    "k": 3,
    "fecf": true
  },
  "steps": [
    {
      "at_us": 1000,
      "input": {
        "clcw": {
          "lockout": false,
          "wait": false,
          "retransmit": false,
          "n_r": 1
        }
      },
      "expect": [],
      "expect_state": "S6"
    },
    {
      "at_us": 1000,
      "input": {
        "query": "next_deadline"
      },
      "expect": [
        {
          "next_deadline": null
        }
      ],
      "expect_state": "S6"
    }
  ]
}
